ID,CareersDes,AdvancedCareers,SixDimensional,RecommendedSkills,Des,TrialDungeonsId,ImgPath
职业ID,职业备注，方便对照,进阶职业说明（如果分男女，前面是男，“|”隔开，后面是女）,六维属性图分布（str=int=agi=vit=dex=luk）,推荐关键技能ID,职业简述,对应试炼副本ID,立绘路径 （男性图片路径=女性图片路径）
2000,剑士,骑士/十字军,99=0=53=0=0=82,200004|200005|200006,剑士拥有坚韧的体魄，具备强大的近战攻击能力，不仅是团队的先锋，还能很好的保护后排输出。,2081,Career/Swordman_M.png=Career/Swordman_F.png
3000,服事,牧师/武僧,0=0=99=99=11=0,300002|300008|300012,服事是神的代理人。他们不仅可以净化亡灵，还能治愈队友，为团队提供增益和后勤保障，是团队中不可缺少的重要角色！,2083,Career/Acolyte_M.png=Career/Acolyte_F.png
4000,魔法师,巫师/贤者,0=0=99=99=11=0,400005|400001|400004,魔法师能够操控多种元素，对敌人造成毁灭性的伤害。但是，魔法师们要注意：精明的魔法师是不会让敌人轻易近身的哦！,2082,Career/Magician_M.png=Career/Magician_F.png
5000,盗贼,刺客/流氓,99=0=11=0=0=99,500010|500024|500025,盗贼精通隐匿和潜行之术，经常率先发动犀利的近身攻击，能对敌人造成致命威胁。,2084,Career/Thief_M.png=Career/Thief_F.png
6000,商人,铁匠/炼金术士,99=0=53=0=0=79,600004|600005,商人拥有他人无以伦比的经商天赋，他们常常低买高卖，摆摊赚钱。一言不合就是金钱攻击，有钱就是任性！,2086,Career/Merchant_M.png=Career/Merchant_F.png
7000,弓箭手,猎人/吟游诗人|猎人/舞娘,0=50=99=0=0=99,700005|700006|700004,弓箭手能够远距离向敌人射出箭矢，拥有很强的机动性和灵活性，掌握着战场上的主动权。,2085,Career/Archer_M.png=Career/Archer_F.png
