Id,PreId,TogetherPreId,Name,TaskDes,Type,Chapter,ChapterName,ServerLevel,AcceptLimitBaseLevel,AcceptLimitJobLevel,PushLevel,AcceptLimitProfession,AcceptLimitSex,AcceptLimitItem,AcceptLimitIdentity,FinishLimitIdentity,FinishLimitCD,AcceptNpc,FinishNpc,ItemAfterAccept,ItemBeforeFinish,AcceptAutoPath,Accepttype,Finishtype,ShortcutShowType,FindwayType,AbandonType,DestroyType,LimitTask,CycleNumber,TargetSubTasks,TargetSubTaskChoose,Target1,SpecialMes1,TargetDes1,Target2,SpecialMes2,TargetDes2,Target3,SpecialMes3,TargetDes3,Target4,SpecialMes4,TargetDes4,Target5,SpecialMes5,TargetDes5,TargetRunType,TaskTrigger,IsReminder,FinishTips,NpcFavors,RewardID,DescAcceptable,DescCanFinish,TalkScript,TaskAcceptScriptTag,TaskFinishScriptTag,HideSymbol,AwardExhibition,IsShield,OpenSystemLimit,LocalizationArea
任务ID（主线：1000000~1999999）,前置任务ID,并列前置限制（任务ID|任务ID……；不仅要完成前置ID，还需要完成这个并列限制ID的任务才算完成所有前置）,任务名称,任务简单描述,任务类型（1，主线任务；2，支线任务；3，职业任务；4，日常任务；5，周环任务；6，引导任务；7，奇遇任务；8，公会任务；9，伊甸园任务；10，爱神任务；11，伊甸园加急）,所属章节（注意：此字段在热更时会调用，必须配置，每章最好控制在20个任务以内，减少消耗）,章节名（可不填）,服务器等级,接取base等级限制（最低等级=最高等级）,接取job等级限制（最低等级=最高等级）,推送等级：推送base等级下限=推送base隐藏等级上限,职业限制（根据职业划分，填取职业ID，可填多个中间用分号隔开；0表示全职业）,性别限制（0，男；1，女；2，无限制）,接取需求道具限制（道具ID=数量|道具ID=数量;接取的时候扣除，可为空）,接取社交身份限制（0：无限制；1，队长；2，异性组队队长接取……持续添加）,交付社交身份限制（0：无限制；1，队长；2，异性组队队长接取……持续添加）,完成时间限制（单位：秒；不填表示无限制）,接取NPC（NPCid=所在场景）,交付NPC（NPCid=所在场景）,接任务获得的任务道具（道具ID=数量|道具ID=数量，可为空）,交任务需要扣除的任务道具（道具ID=数量|道具ID=数量，可为空）,接取后是否自动寻路（0.接取后不自动寻路1.接取后自动寻路）,接取形式（1：正常对话接取；2，自动接取；3，飞鸽传书）,交付形式（1：正常对话交付；2，自动交付）,快捷追踪方式（1，不可接取的时候就显示追踪；2，可接取的时候就显示追踪；3，接取之后才显示追踪）,寻路模式（1，自动寻路；2，引导提示；3，不能寻路，全靠自己找）,放弃类型（0不可放弃，1放弃任务重新开始，不保留目标进度，随机目标可再次随机目标2放弃任务后，重新接取任务，任务目标不变，任务目标的完成程度不保留3放弃任务后，重新接取任务，任务目标完成程度保留，从未完成的任务目标开始做）,销毁方式（本字段仅针对配置了接取等级上限的任务有效。1，普通销毁：已接取的过了等级段还保留；2，全部销毁：表示过了这个等级段不管接取与否，完成与否，强制删除）,任务限制销毁,周期内可以完成多少次（表示在一个刷新周期内这个任务可以重复完成多少次，目前仅对日常任务、周常任务有效）,任务群组（用于配置子任务list，如果此处有数据，则后面的123个目标配置无效）,任务群组中子任务选取方式（1，系统随机选取1个任务给你；2，依次接取任务；3，玩家自由选取1个任务；4，伊甸园专用）,任务目标1：目标类型|目标参数=参数数量|寻路场景id=X=Y=Z\r\n（1，对话；2，打怪；3：采集；4，收集；5，寻路；6：使用道具；7：完成副本；8：完成操作；9：拍照；10：活动任务；11：成就任务；12：公会任务；13：社交任务；14：脚本；15：打怪收集；16父子任务，17进入副本，18单人烹饪；19，完成双人烹饪副本；20搭乘公共载具；21，与场景进行交互；22，搭乘单人载具）,任务特殊信息,目标1描述,任务目标2,目标2特殊参数,目标2描述,任务目标3,目标3特殊参数,目标3描述,任务目标4,目标4特殊参数,目标4描述,任务目标5,目标5特殊参数,目标5描述,目标执行方式（1，并列执行；2，依次执行）,场景触发器：时机=时机参数=事件类型=事件参数=其他参数1=其他参数2=其他参数3|……（具体配置方式请查看“Comments_task配置字段说明”sheet）\r\n,完成反馈是否在完成任务的时候飘,完成任务时飘字（不想飘不填即可）,NPC好感度（NPCID=好感度数值|NPCID=好感度数值，标识完成任务后给该NPC增加好感度）,奖励ID,任务可接取时的描述,任务已完成时的描述,任务用脚本名字（Assets\Resources\CommandScript\Task路径下面配置任务对白文本名）,接任务剧本tag,交任务剧本tag,是否隐藏npc头顶符号,任务追踪界面奖励预览展示（配置道具ID，不配置则不显示）,是否屏蔽该任务（如果任务通过调整等级，暂时屏蔽了，需要在这里配置，默认0，不屏蔽）,功能开启限制（即使其他条件达成，也需要该功能开启后才会推送该任务，如果已经推送的任务，中途后台关闭了该功能，则也会在刷新任务列表时隐藏该任务）,本地化区域划分(0所有1中2日4香港8韩16北美，多地区时数字叠加，例：日韩都上就配4+8=12)
20001010,,,结识佣兵,,30,20010,佣兵引导,,20=0,0=0,20=0,0,2,,0,,,10131=15,,,,0,1,2,2,1,1,1,,,,,1|10132=15,Mercenary_20001010_accept01,找团长旁边的导师详细了解一下佣兵吧,,,,,,,,,,,,,2,4=1=19=122,,,,,乐园团团长似乎有事对你说,,20010,Mercenary_20001010_accept,,,,,,16
20000310,,,星光剑士雷金,你来到伊斯鲁得，发现最近城里有些人心惶惶，于是找到当地士兵询问发生了什么事,20,20003,剑士佣兵男,,28=0,0=0,28=0,0,2,,0,,,1324=21,50246=21,,,0,1,1,3,1,1,1,,,,,1|1382=21,Adventure_20000310_exec_1,找到骑士团报名加入治安小队,1|50245=21,Adventure_20000310_exec_2,一个青年拦住了你，询问他有什么事,5|0=1|21=120.39=17.18=135.72,,与雷金一起前往魔物清剿地,2|150076=5|21=111.81=17.29=135.89,,先消灭这些魔物吧,,,,2,4=1=3=50245=21=140.32=17.29=158.21=320.28|1=0=22=5031|4=2=4=50245|4=2=10=3530301|4=3=23=3530301|4=3=3=50246=21=114.61=17.29=138.24=259.62|4=3=7=150076=5=21=111.81=17.29=135.89=4|4=4=8=150076=5|4=3=14=1=0=11086|4=2=3=50256=21=111.79=17.29=137.89=160.00|4=4=4=50256|4=4=3=50257=21=111.79=17.29=137.89=160.00|4=4=14=1=0=11088|3=0=14=1=0=11089,,,,1400010,最近伊斯鲁得城内出现了一些状况，去打听看看发生了什么事,雷金没有出手帮忙，你十分奇怪雷金的行为，问问他原因,20003,Adventure_20000310_accept,Adventure_20000310_finish,,,,,
20000320,20000310,,星光剑士雷金,得知城中受到魔物侵扰的你，报名成为了魔物清剿小队的一员，与雷金一起赶往清剿现场清剿魔物,20,20003,剑士佣兵男,,28=0,0=0,28=0,0,2,,0,,,50257=21,50249=21,,,1,1,1,2,1,1,1,,,,,5|0=1|21=102.00=17.29=165.07,,继续去赶往魔物清剿地,7|2214=1||21=98.82=17.29=165.63,,帮助魔物清剿小队消灭魔物,,,,,,,,,,2,1=0=4=50246|4=1=3=50247=21=101.18=17.29=168.30=264.77|1=0=3=50249=21=94.87=17.29=165.70=57.40|1=0=3=50250=21=96.87=17.29=169.32=119.99|1=0=3=50251=21=99.31=17.29=164.93=352.34|1=0=10=3530401|4=1=23=3530401|4=1=15=20000320|1=0=5=1357|1=0=5=1358|1=0=7=1047=5=21=98.10=17.29=167.11=4|4=2=8=1047=5|1=0=4=50257|4=1=1=2214|4=2=2=2214,,,,1400020,去关心一下落单的成员有没有事,消灭了这些扰城的魔物，小队成员开始讨论起了雷金,20003,Adventure_20000320_accept,Adventure_20000320_finish,,,,,
20000330,20000320,,星光剑士雷金,雷金的小心思被小队成员发现，但雷金确实帮助了大家，雷金感谢你为他说话，告诉了你佣兵相关的事宜,20,20003,剑士佣兵男,,28=0,0=0,28=0,0,2,,0,,,50247=21,50247=21,,,1,1,1,2,1,1,1,,,,,27|5043=1|21=99.53=17.29=168.16,45,查看雷金出示的战力表,1|50251=21,Adventure_20000330_exec_1,看看他们还有什么话要说,,,,,,,,,,2,4=2=4=50249|4=2=4=50250|4=2=4=50251|4=1=22=5032|4=5=22=5033|3=0=4=50247|3=0=19=122,,,,1400030,雷金似乎不服，询问雷金的为什么这么做,误会已经解除了，雷金似乎还有什么话要说,20003,Adventure_20000330_accept,Adventure_20000330_finish,,,,,
20000210,,,傲娇弓手申智,去弓手村找到弓手佣兵的负责人，让他给你介绍一位合适的弓手佣兵吧！,20,20002,弓箭手佣兵,,20=0,0=0,20=0,0,2,,0,,,5704=52,0=0,,,1,1,2,2,1,1,1,,,,,5|0=1|52=71.84=10.38=64.23,,去找到申智说明自己的来意,3|200810=1|52=68.05=10.38=63.61,,捡起地上的箭袋看看,1|50230=52,Adventure_20000210_exec,找到申智，把路上捡到的箭袋还给她,27|5041=1|52=69.97=13.38=78.63,,把箭袋归还给申智,,,,2,1=0=11=200810=1=52=66.97=10.38=63.84|4=2=12=200810=1|4=1=14=1=0=11081|4=2=14=1=0=11082|1=0=3=50230=52=70.85=13.38=78.88=332.45,,,,1400040,去弓手村寻找一位合适的弓手佣兵吧,,20002,Adventure_20000210_accept,,,,,,
20000220,20000210,,傲娇弓手申智,申智是一个十分傲娇的人，非要打赢她证明自己的实力才能获得她的认可，只好先接受申智的挑战了,20,20002,弓箭手佣兵,,20=0,0=0,20=0,0,2,,0,,,50230=52,50230=52,,,1,1,1,2,1,1,1,,,,,7|2218=1||52=70.45=13.38=79.62,,接受申智的测试，向她展示你的实力,,,,,,,,,,,,,2,3=0=3=50233=52=65.39=13.38=78.56=92.43|1=0=1=2218|2=0=2=2218,,,,1400050,申智对自己的箭袋不屑一顾，先告知她你的来意吧,申智被你打败，看起来十分沮丧，安慰一下她吧,20002,Adventure_20000220_accept,Adventure_20000220_finish,,,,,
20000230,20000220,,傲娇弓手申智,被我打败的申智有些沮丧，说起了她的心事，骄傲面具下的她有些令人心疼,20,20002,弓箭手佣兵,,20=0,0=0,20=0,0,2,,0,,,50233=52,50238=52,,,1,1,1,2,1,1,1,,,,,5|0=1|52=52.02=13.38=87.41,,赶往报信员说的魔物暴动现场看看,2|150075=5|52=43.87=13.38=84.97,,与申智一起消灭这些魔物,,,,,,,,,,2,4=1=4=50233|1=0=4=50230|1=0=10=3530201|4=1=23=3530201|4=1=3=50231=52=44.30=13.38=89.87=150.39|1=0=3=50234=52=42.08=13.38=83.44=29.05|1=0=3=50235=52=41.87=13.38=87.61=142.89|1=0=3=50236=52=43.53=13.38=86.06=72.30|4=2=4=50234|4=2=4=50235|4=2=4=50236|4=2=3=50237=52=42.08=13.38=83.44=29.05|4=2=3=50238=52=41.87=13.38=87.61=142.89|4=2=3=50239=52=43.53=13.38=86.06=72.30|3=0=4=50237|3=0=4=50238|3=0=4=50239|4=1=14=1=0=11083|4=1=7=150075=5=52=46.89=13.30=87.87=3|4=2=8=150075=5|4=2=4=50231|4=2=3=50240=52=44.30=13.38=89.87=150.39,,,,1400060,原来骄傲面具下的申智，也有难以排解的忧伤,与申智一起消灭了魔物，拯救了村民，村民们似乎有话要说,20002,Adventure_20000230_accept,Adventure_20000230_finish,,,,,
20000240,20000230,,傲娇弓手申智,帮助了村民的申智面对大家的夸奖，显得有些局促，但因为这件事，申智心中的问题慢慢有了答案,20,20002,弓箭手佣兵,,20=0,0=0,20=0,0,2,,0,,,50240=52,50240=52,,,1,1,1,2,1,1,1,,,,,3|200811=1|52=88.66=13.38=42.97,,帮助申智去寻找修补箭袋的皮革制品,27|5042=1|52=45.59=13.38=88.16,,将皮革交给申智,37|2=1,,等待申智修复好箭袋,,,,,,,2,1=0=11=200811=1=52=89.33=13.38=42.77|4=1=12=200811=1|4=1=14=1=0=11084|4=3=14=2=50240=11085|3=0=4=50240|3=0=19=122,,,,1400070,村民们的话似乎给了申智一些思考，申智陷入了沉思,申智修补好了箭袋并找到了弓手的意义，看起来对接下来的佣兵历练充满兴趣。,20002,Adventure_20000240_accept,Adventure_20000240_finish,,,,,
20000510,,,爱心服事莉莉拉,普隆德拉的服事佣兵负责人向你推荐一位服事佣兵。如果需要的话，就去看看吧！,20,20005,服事佣兵,,28=0,0=0,28=0,0,2,,0,,,3542=41,1248=7,,,1,1,1,3,1,1,1,,,,,5|0=1|7=51.19=10.00=50.12,,去集市上碰碰运气，看看能不能找到莉莉拉,1|1244=7,Mercenary_20000510_exec_1,找附近的摊主打听一下,3|200477=1|7=46.15=9.82=44.44,,这里有有一些脚印,5|0=1|7=44.09=10.00=57.90,,跟上脚印去看看,,,,2,4=2=11=200477=1=7=45.73=10.00=45.99|4=3=12=200477=1|4=1=14=1=0=10475|4=3=14=1=0=10476|1=0=3=50283=7=44.45=10.00=71.72=180|4=2=14=1=0=11097|2=0=14=1=0=11099,,,,1400080,可以拥有一位服事做为你的佣兵啦！快去看看吧！,脚印消失了，跟周围的路人打听一下,20050,Mercenary_20000510_accept,Mercenary_20000510_finish,,,,,
20000520,20000510,,爱心服事莉莉拉,这串脚印是谁留下的呢？跟摊主丢失的鱼有什么关系吗？跟上去看看。,20,20005,服事佣兵,,28=0,0=0,28=0,0,2,,0,,,1039=7,0=0,,,1,1,2,2,1,1,1,,,,,5|0=1|7=42.96=10.00=71.33,,那个路人给你指了个方向，去看看,3|200479=1|7=43.63=9.82=71.07,,看看这只小猫咪怎么了,1|50280=7,Mercenary_20000520_exec_1,跟莉莉拉解释，不是你伤害的小猫咪,1|50280=7,Mercenary_20000520_exec_2,这只猫咪怎么会晕倒在这里呢？莉莉拉充满了疑问,3|200478=1|7=42.34=10.00=74.11,1,这是小猫咪刚吃过的鱼，检查一下有没有问题,2,1=0=11=200478=1=7=42.34=10.00=74.11|2=0=12=200478=1|4=2=3=50280=7=40.29=10.00=69.97=108.24|4=1=14=1=0=10477|4=4=14=1=0=10478|4=2=14=2=50280=10481|4=3=24=2690501=7=44.05=10.00=72.08|4=1=11=200479=1=7=44.38=9.82=71.86|4=2=12=200479=1|3=0=25=2690501|4=3=15=20000520,,,,1400090,刚刚那个人并没有注意到，再找找其他人打听一下,,20050,Mercenary_20000520_accept,,,,,,
20000530,20000520,,爱心服事莉莉拉,莉莉拉的秘密基地？有什么神奇的地方吗？看着眼前这个漂亮的女孩子，突然有点期待那个秘密基地呢！,20,20005,服事佣兵,,28=0,0=0,28=0,0,2,,0,,,50280=7,1244=7,,,1,1,1,2,1,1,1,,,,,5|0=1|7=33.86=10.00=138.78,,前往莉莉拉的秘密基地,1|50281=7,Mercenary_20000530_exec_1,这些小猫都是莉莉拉在照顾的吧,27|3035=1|7=32.57=10.00=138.38,252.82,用小鱼和猫猫互动,1|50281=7,Mercenary_20000530_exec_2,这些小鱼会是洛里菲丢失的那些吗？问问莉莉拉,5|0=1|7=46.73=9.82=42.66,,和莉莉拉一起去集市找洛里菲,2,1=0=4=50280|1=0=3=50281=7=40.29=10.00=69.97=108.24|4=4=4=50281|1=0=3=50284=7=30.35=10.00=137.90=105.28|1=0=3=50285=7=31.96=10.00=140.00=105.28|1=0=3=50286=7=32.35=10.00=136.73=15.28|3=0=4=50284|3=0=4=50285|3=0=4=50286|4=4=3=50282=7=35.78=10.00=139.50=285.28|3=0=4=50282|4=1=14=1=0=10479|4=3=14=1=0=10480|4=1=4=50283,,,,1400100,告诉莉莉拉你的检查结果,告诉洛里菲摊主你的调查结果吧,20050,Mercenary_20000530_accept,Mercenary_20000530_finish,,,,,
20100000,,,统御之证,想要雇佣更多的佣兵吗？需要获得骑士团相关负责人的认可，但是具体记不清了，去普隆德拉大教堂找佣兵管理员问问吧,20,20100,领袖勋章,,42=0,0=0,42=0,0,2,,0,,,3542=41,1048=7,,,1,1,1,2,1,1,1,,,,,1|1048=7,Mercenary_20100000_exec,名誉骑士有他的考核办法，听听他怎么说,2|140099=3|7=58.14=10.00=196.65,,击败默契度考验官，完成统御之证的考验,27|4078=1|7=51.31=10.00=201.17,,通过了测验，接过名誉骑士给你的统御之证,,,,,,,2,4=1=7=140099=3=7=59.94=10.00=195.08=4|4=2=8=140099=3|4=2=14=2=1048=10932,,,,1400110,想要带领两个佣兵吗？去普隆德拉大教堂找服事佣兵管理员伊欧娜问问吧,完成了考验，也领到了统御之证，名誉骑士似乎有话要说,20002,Mercenary_20100000_accept,Mercenary_20100000_finish,,,,,
20000000,,,孤独法师亚由美,去吉芬找到法师佣兵管理员爱奴智，让他介绍一位合适的法师佣兵给你,20,20000,法师佣兵,,42=0,0=0,42=0,0,2,,0,,,1680=16,0=0,,,1,1,2,3,1,1,1,,,,,5|0=1|16=147.72=17.03=93.92,,去集市寻找亚由美,5|0=1|16=149.86=17.03=81.93,,那边的角落似乎有什么动静，去看看,7|2241=1||16=152.76=17.03=79.47,,帮助亚由美赶跑欺负她的人,,,,,,,2,1=0=3=50201=16=155.68=17.03=75.68=339.77|4=1=14=1=0=11072|1=0=3=50204=16=154.08=17.03=79.27=135.05|4=3=4=50204|4=2=1=2241|2=0=2=2241,,,,1400120,去吉芬找到佣兵管理员询问法师佣兵相关事宜,问问亚由美是否受到惊吓,20000,Adventure_20000000_accept,,,,,,
20000010,20000000,,孤独法师亚由美,亚由美似乎看起来十分的孤僻，追上亚由美去告知亚由美自己此行的目的吧,20,20000,法师佣兵,,42=0,0=0,42=0,0,2,,0,,,50201=16,50206=16,,,1,1,1,2,1,1,1,,,,,3|200807=1|16=153.87=17.03=77.41,,捡起地上的本子看看,27|5039=1|16=153.87=17.03=77.41,,打开这本日记看看,5|0=1|16=117.83=17.03=54.66,,去追上亚由美，归还她的日记,2|150077=10|16=112.09=17.03=53.73,,帮助亚由美消灭这些魔物,,,,2,1=0=4=50201|1=0=3=50202=16=107.86=17.03=51.40=69.94|1=0=14=1=0=11073|4=1=14=1=0=11074|4=2=22=5030|4=3=14=1=0=11076|4=3=7=150077=10=16=109.61=17.03=52.39=5|4=4=8=150077=10|1=0=11=200807=1=16=154.07=17.03=76.57|4=1=12=200807=1|4=4=4=50202|4=4=3=50206=16=107.86=17.03=51.40=69.94|3=0=14=1=0=11087|4=3=24=2690956=16=107.86=17.03=51.4|2=0=25=2690956,,,,1400130,忘了亚由美听不见这件事，用手比划比划吧,告知亚由美自己的来意,20000,Adventure_20000010_accept,Adventure_20000010_finish,,,,,
20000020,20000010,,孤独法师亚由美,原来看起来孤僻的亚由美实际上十分的渴望友情，想办法打开亚由美的心扉吧,20,20000,法师佣兵,,42=0,0=0,42=0,0,2,,0,,,1639=16,50206=16,,,1,1,1,2,1,1,1,,,,,1|50206=16,Adventure_20000020_exec,告知亚由美给她买了冰淇淋,27|5040=1|16=109.65=17.03=51.99,255,给亚由美冰淇淋,,,,,,,,,,2,3=0=4=50206,,,,1400140,去找冰淇淋店主购买冰淇淋吧,询问亚由美是否愿意成为自己的佣兵,20000,Adventure_20000020_accept,Adventure_20000020_finish,,,,,
20000110,,,勇气商人娜塔莉,去艾尔贝塔找到商人佣兵管理员，让他介绍一位合适的商人佣兵给你吧,20,20001,商人佣兵,,42=0,0=0,42=0,0,2,,0,,,3054=50,0=0,,,1,1,2,3,1,1,1,,,,,5|0=1|50=154.62=19.40=89.91,,去集市附近寻找娜塔莉,1|50217=50,Adventure_20000110_exec_1,询问这个青年发生了什么,1|50215=50,Adventure_20000110_exec_2,告知娜塔莉自己此行的目的,7|2219=1||50=155.55=19.63=89.31,,娜塔莉似乎很生气，先让她冷静下来吧,,,,2,1=0=3=50215=50=157.19=19.47=90.58=172.80|1=0=3=50217=50=157.27=19.47=89.35=352.80|4=1=15=20000110|4=3=4=50217|4=3=1=2219|2=0=2=2219|4=2=15=20000111,,,,1400150,去艾尔贝塔寻找佣兵管理员询问商人佣兵事宜,终于让娜塔莉冷静下来了，询问她为什么这么生气,20001,Adventure_20000110_accept,,,,,,
20000120,20000110,,勇气商人娜塔莉,破坏了娜塔莉的告白，得帮助她好好再准备一场隆重的告白仪式,20,20001,商人佣兵,,42=0,0=0,42=0,0,2,,0,,,50215=50,50216=50,,,1,1,1,2,1,1,1,,,,,3|200808=1|50=212.53=17.27=106.29,,帮助娜塔莉采集海盐结晶,34|101006=1|50=159.07=17.23=140.75,50=103.12=22.27=206.46,找到娜塔莉的一箱气球，把这箱气球搬运到观景区,,,,,,,,,,2,1=0=4=50215|1=0=3=50216=50=102.19=22.27=210.19=174.14|1=0=11=200808=1=50=213.99=17.27=107.18|4=1=12=200808=1|4=1=11=200809=1=50=158.84=17.27=141.69|4=2=12=200809=1|3=0=3=50219=50=105.58=22.27=120.64=308.9|4=2=3=50225=50=103.66=22.27=207.32=206.16|4=1=14=1=0=11090,,,,1400160,作为补偿，帮助娜塔莉筹备一场正式的告白仪式,准备好了告白前的物资，询问娜塔莉接下去的步骤,20001,Adventure_20000120_accept,Adventure_20000120_finish,,,,,
20000130,20000120,,勇气商人娜塔莉,帮助娜塔莉准备好了告白仪式，帮助她把里斯特带到告白现场，但结局会如何呢？,20,20001,商人佣兵,,42=0,0=0,42=0,0,2,,0,,,50219=50,50216=50,,,1,1,1,2,1,1,1,,,,,5|0=1|50=101.33=22.27=203.08,,带着里斯特去告白现场,1|50216=50,Adventure_20000130_exec_1,告诉娜塔莉已经将里斯特带到，把现场留给他们两个,37|3=1|50=100.15=22.17=207.37,,等待娜塔莉告白,1|50226=50,Adventure_20000130_exec_2,娜塔莉告白被拒绝，里斯特似乎有话跟你说,,,,2,4=1=14=1=0=11078|4=2=15=20000130|4=4=14=2=50216=11079|1=0=3=50220=50=99.74=22.27=209.11=308.08|1=0=3=50221=50=105.29=22.27=211.29=178.05|1=0=3=50222=50=104.24=22.27=214.34=341.00|1=0=3=50223=50=100.82=22.27=213.09=192.43|1=0=3=50224=50=102.47=22.27=213.47=4.42|3=0=4=50220|3=0=4=50221|3=0=4=50222|3=0=4=50223|3=0=4=50224|3=0=4=50216|1=0=4=50225|1=0=10=3530101|4=1=23=3530101|1=0=4=50219|4=1=3=50226=50=101.57=22.27=204.85=353.57|2=0=4=50226,,,,1400170,遵照娜塔莉的指示去把里斯特带到告白现场,告白没有成功，询问娜塔莉是否要打拼事业，签订佣兵条约,20001,Adventure_20000130_accept,Adventure_20000130_finish,,,,,
20000410,,,痞子盗贼乔诺,梦罗克的佣兵管理员给你推荐的盗贼佣兵名叫乔诺，快去寻找他吧！,20,20004,盗贼佣兵,,42=0,0=0,42=0,0,2,,0,,,1912=26,50261=51,,,1,1,1,3,1,1,1,,,,,1|1957=26,Mercenary_20000410_exec_1,向周边的居民打听乔诺在哪,5|0=1|51=37.38=21.96=34.39,,去周围居民口中所说的黑店找乔诺,1|50261=51,Mercenary_20000410_exec_2,询问一下发生了什么事，保镖为何咄咄逼人？,7|2242=1||51=41.70=21.96=35.57,,他好像误解了你，打败他让他冷静下来,,,,2,1=0=3=50261=51=42.43=21.96=37.60=213.94|1=0=3=50262=51=41.70=21.96=35.57=33.94|3=0=4=50261|4=4=4=50262|4=1=3=50264=26=63.48=9.91=107.33=180.00|4=2=15=20000410|4=3=1=2242|2=0=2=2242,,,,1400180,可以拥有一个盗贼佣兵了！去找梦罗克的佣兵管理员咨询一下详情,和乔诺一起找个安全的地方谈谈吧,20040,Mercenary_20000410_accept,Mercenary_20000410_finish,,,,,
20000420,20000410,,痞子盗贼乔诺,明明刚刚帮助了这个乔诺，他却给你没有好脸色，还嫌弃你多管闲事。这个乔诺真是很欠揍啊！,20,20004,盗贼佣兵,,42=0,0=0,42=0,0,2,,0,,,50264=26,0=0,,,1,1,2,2,1,1,1,,,,,27|3032=1|26=62.10=9.91=106.67,,事情的原委应该能从这封信中知道吧！,1|50264=26,Mercenary_20000420_exec,这封信与乔诺在黑店做的事情又有什么关系呢？,3|200476=1|26=178.08=9.85=169.27,,挖取埋藏在旅馆旁边马厩里的吐真药剂,,,,,,,2,2=0=3=50265=26=55.72=9.91=84.27=75.84|2=0=3=50267=26=52.63=9.91=81.24=75.84|4=2=11=200476=1=26=179.11=9.91=169.16|2=0=12=200476=1|4=1=22=3008|2=0=4=50264,,,,1400190,乔诺看样子很生气，明明救了他，现在反倒像是做错了一样。,,20040,Mercenary_20000420_accept,,,,,,
20000430,20000420,,痞子盗贼乔诺,这次一定要帮助乔诺问到托力的消息，人不能就这样无缘无故的消失！,20,20004,盗贼佣兵,,42=0,0=0,42=0,0,2,,0,,,50265=26,50266=26,,,1,1,1,2,1,1,,,,,,27|3033=1|26=54.86=9.91=80.73,268.02,趁保镖不注意，快使用药剂,1|50267=26,Mercenary_20000430_exec_1,询问托力的事情,1|1958=26,Mercenary_20000430_exec_2,找到保镖口中那个退休的保镖队长,27|3034=1|26=164.39=9.85=60.32,,看看保密协议上都写了什么,,,,2,4=2=3=50266=26=55.72=9.91=84.27=75.84|4=2=4=50265|3=0=4=50266|4=4=22=3009|2=0=4=50267|4=1=24=2690966=26=52.63=9.91=81.24|4=2=25=2690966,,,,1400200,拿到药了，去跟乔诺汇合吧！,安慰一下失落的乔诺,20040,Mercenary_20000430_accept,Mercenary_20000430_finish,,,,,
20001200,20000330,,剑士佣兵进阶,找到剑士佣兵管理员塞巴利斯打听佣兵进阶事宜，完成塞巴利斯的指示,20,20012,剑士佣兵进阶任务,,40=0,0=0,40=0,0,2,,0,,,1349=21,1349=21,,,1,1,1,3,1,1,1,,,,,2|1020=10|505=134.48=12.43=73.11,,击败魔物，完成试炼,2|1092=10|505=150.49=12.43=69.15,,,,,,,,,,,,1,,,,,1400210,找到剑士佣兵管理员询问剑\r\n士佣兵进阶相关事宜,完成了魔物清剿，去找佣兵管理员交差吧,20012,Adventure_20001200_accept,Adventure_20001200_finish,,,,,
20001600,20000240,,弓手佣兵进阶,找到弓手佣兵管理者打听弓手佣兵进阶事宜,20,20012,弓手佣兵进阶,,40=0,0=0,40=0,0,2,,0,,,5704=52,5704=52,,,1,1,1,3,1,1,1,,,,,2|1176=20|48=129.75=46.96=125.21,,击败魔物，完成试炼,,,,,,,,,,,,,1,,,,,1400220,找到弓手佣兵管理员询问弓手佣兵进阶相关事宜,完成了魔物清剿，去找佣兵管理员交差吧,20012,Adventure_20001600_accept,Adventure_20001600_finish,,,,,
20001300,20000530,,服事佣兵进阶,找到服事佣兵管理者打听服事佣兵进阶事宜,20,20012,服事佣兵进阶,,40=0,0=0,40=0,0,2,,0,,,3542=41,3542=41,,,1,1,1,3,1,1,1,,,,,2|1104=8|7=167.64=10.80=207.59,,击败魔物，完成试炼,,,,,,,,,,,,,1,1=0=7=1104=8=7=171.14=10.80=218.13=10|2=0=8=1104=8,,,,1400230,找到服事佣兵管理员询问服事佣兵进阶相关事宜,完成了魔物清剿，去找佣兵管理员交差吧,20012,Adventure_20001300_accept,Adventure_20001300_finish,,,,,
20001400,20000020,,法师佣兵进阶,找到法师佣兵管理者打听法师佣兵进阶事宜,20,20012,法师佣兵进阶,,42=0,0=0,42=0,0,2,,0,,,1680=16,1680=16,,,1,1,1,3,1,1,1,,,,,2|1175=12|10=75.32=11.62=42.17,,击败魔物，完成试炼,,,,,,,,,,,,,1,,,,,1400240,找到法师佣兵管理员询问法师佣兵进阶相关事宜,完成了魔物清剿，去找佣兵管理员交差吧,20012,Adventure_20001400_accept,Adventure_20001400_finish,,,,,
20001500,20000130,,商人佣兵进阶,找到商人佣兵管理者打听商人佣兵进阶事宜,20,20012,商人佣兵进阶,,42=0,0=0,42=0,0,2,,0,,,3054=50,3054=50,,,1,1,1,3,1,1,1,,,,,2|1034=5|35=91.62=3.60=120.54,,击败魔物，完成试炼,2|1126=5|35=94.02=3.67=174.55,,,,,,,,,,,,1,,,,,1400250,找到商人佣兵管理员询问商人佣兵进阶相关事宜,完成了魔物清剿，去找佣兵管理员交差吧,20012,Adventure_20001500_accept,Adventure_20001500_finish,,,,,
