Id,PreId,TogetherPreId,Name,TaskDes,Type,Chapter,ChapterName,ServerLevel,AcceptLimitBaseLevel,AcceptLimitJobLevel,PushLevel,AcceptLimitProfession,AcceptLimitSex,AcceptLimitItem,AcceptLimitIdentity,FinishLimitIdentity,FinishLimitCD,AcceptNpc,FinishNpc,ItemAfterAccept,ItemBeforeFinish,AcceptAutoPath,Accepttype,Finishtype,ShortcutShowType,FindwayType,AbandonType,DestroyType,LimitTask,CycleNumber,TargetSubTasks,TargetSubTaskChoose,Target1,SpecialMes1,TargetDes1,Target2,SpecialMes2,TargetDes2,Target3,SpecialMes3,TargetDes3,Target4,SpecialMes4,TargetDes4,Target5,SpecialMes5,TargetDes5,TargetRunType,TaskTrigger,IsReminder,FinishTips,NpcFavors,RewardID,DescAcceptable,DescCanFinish,TalkScript,TaskAcceptScriptTag,TaskFinishScriptTag,HideSymbol,AwardExhibition,IsShield,OpenSystemLimit,LocalizationArea
任务ID（主线任务：1000000—1999999；支线任务：2000000—2999999；职业任务：3000000—3999999；日常任务：4000000—4999999；周常任务：5000000—5999999；引导任务：6000000—6999999；奇遇任务：7000000—7999999；公会任务：8000000—8999999；伊甸园任务：9000000—9999999；爱神任务：10000000—10999999；伊甸园加急：11000000—11999999；冒险任务：12000000—12999999；主题副本：13000000—13999999；生活支线：14000000—14999999）,前置任务ID（任务ID|任务ID……；满足其中一个即可，是“或”的关系，可为空）,并列前置限制（任务ID|任务ID……；不仅要完成前置ID，还需要完成这个并列限制里面的所有任务才算完成所有前置，这个字段里面的id是“与”的关系，可为空）,任务名称,任务简单描述,任务类型（1，主线任务；2，支线任务；3，职业任务；4，日常任务；5，周常任务；6，引导任务；7，奇遇任务；8，公会任务；9，伊甸园任务；10，爱神任务；11，伊甸园加急；冒险任务，类型是12；副本任务，类型是13；生活支线 14；）,所属章节,章节名（可不填）,服务器等级,接取base等级限制（最低等级=最高等级；上限或者下线无限制的地方填0）,接取job等级限制（最低等级=最高等级；上限或者下线无限制的地方填0）,推送等级：推送base等级下限=推送base隐藏等级上限,职业限制（根据职业划分，填取职业ID，可填多个中间用分号隔开；0表示全职业）,性别限制（0，男；1，女；2，无限制）,接取需求道具限制（道具ID=数量|道具ID=数量;接取的时候扣除，可为空）,接取社交身份限制（0：无限制；1，队长；2，异性组队队长接取……持续添加）,交付社交身份限制（0：无限制；1，队长；2，异性组队队长接取……持续添加）,完成时间限制（单位：秒；不填表示无限制）,接取NPC（NPCid=所在场景）,交付NPC（NPCid=所在场景）,接任务获得的任务道具（道具ID=数量|道具ID=数量，可为空）,交任务需要扣除的任务道具（道具ID=数量|道具ID=数量，可为空，任务道具给的道具记得在这里回收）,接取后是否自动寻路（0.接取后不自动寻路1.接取后自动寻路）,接取形式（1：正常对话接取；2，自动接取；3，飞鸽传书）,交付形式（1：正常对话交付；2，自动交付）,快捷追踪方式（1，不可接取的时候就显示追踪；2，可接取的时候就显示追踪；3，接取之后才显示追踪）,寻路模式（1，自动寻路；2，引导提示；3，不能寻路，全靠自己找）,放弃类型（0不可放弃，1放弃任务重新开始，不保留目标进度，随机目标可再次随机目标2放弃任务后，重新接取任务，任务目标不变，任务目标的完成程度不保留3放弃任务后，重新接取任务，任务目标完成程度保留，从未完成的任务目标开始做）,销毁方式（本字段仅针对配置了接取等级上限的任务有效。1，普通销毁：已接取的过了等级段还保留；2，全部销毁：表示过了这个等级段不管接取与否，完成与否，强制删除）,任务限制销毁,周期内可以完成多少次（表示在一个刷新周期内这个任务可以重复完成多少次，目前仅对日常任务、周常任务有效）,任务群组（用于配置子任务list，仅是父任务组要配置；如果此处有数据，则后面的123个目标配置无效）,任务群组中子任务选取方式（1，系统随机选取1个任务给你；2，依次接取任务；3，玩家自由选取1个任务；4，伊甸园专用）,任务目标1：目标类型|目标参数=参数数量|寻路场景id=X=Y=Z；具体请查看说明文档，路径：rodoc\策划\配置说明文档\r\n（1，对话；2，打怪；3：采集；4，收集；5，寻路；6：使用道具；7：完成副本；8：完成操作；9：拍照；10：活动任务；11：成就任务；12：公会任务；13：社交任务；14：脚本；15：打怪收集；16父子任务，17进入副本，18单人烹饪；19，完成双人烹饪副本；20搭乘公共载具；21，与场景进行交互；22，搭乘单人载具）,任务特殊信息,目标1描述,任务目标2：目标类型|目标参数=参数数量|寻路场景id=X=Y=Z；具体请查看说明文档，路径：rodoc\策划\配置说明文档\r\n（1，对话；2，打怪；3：采集；4，收集；5，寻路；6：使用道具；7：完成副本；8：完成操作；9：拍照；10：活动任务；11：成就任务；12：公会任务；13：社交任务；14：脚本；15：打怪收集；16父子任务，17进入副本，18单人烹饪；19，完成双人烹饪副本；20搭乘公共载具；21，与场景进行交互；22，搭乘单人载具）,目标2特殊参数,目标2描述,任务目标3：目标类型|目标参数=参数数量|寻路场景id=X=Y=Z；具体请查看说明文档，路径：rodoc\策划\配置说明文档\r\n（1，对话；2，打怪；3：采集；4，收集；5，寻路；6：使用道具；7：完成副本；8：完成操作；9：拍照；10：活动任务；11：成就任务；12：公会任务；13：社交任务；14：脚本；15：打怪收集；16父子任务，17进入副本，18单人烹饪；19，完成双人烹饪副本；20搭乘公共载具；21，与场景进行交互；22，搭乘单人载具）,目标3特殊参数,目标3描述,任务目标4,目标4特殊参数,目标4描述,任务目标5,目标5特殊参数,目标5描述,目标执行方式（1，并列执行；2，依次执行）,场景触发器：时机=时机参数=事件类型=事件参数=其他参数1=其他参数2=其他参数3|……（具体请查看说明文档，路径：rodoc\策划\配置说明文档）\r\n,是否在完成任务的时候飘任务完成的特效反馈,完成任务时飘字（不想飘不填即可）,NPC好感度（NPCID=好感度数值|NPCID=好感度数值，标识完成任务后给该NPC增加好感度，本字段暂时无效）,奖励ID（对应奖励表ID）,任务可接取时的描述,任务已完成时的描述,任务用脚本名字（Assets\Resources\CommandScript\Task路径下面配置任务对白文本名）,接任务剧本tag,交任务剧本tag,NPC显示头顶符号。不配置则默认为0。若配置为1则该任务NPC不显示头顶符号。,任务追踪界面奖励预览展示（配置道具ID，不配置则不显示）,是否屏蔽该任务（如果任务通过调整等级，暂时屏蔽了，需要在这里配置，默认0，不屏蔽）,功能开启限制（即使其他条件达成，也需要该功能开启后才会推送该任务，如果已经推送的任务，中途后台关闭了该功能，则也会在刷新任务列表时隐藏该任务）,本地化区域划分(0所有1中2日4香港8韩16北美，多地区时数字叠加，例：日韩都上就配4+8=12)
12001410,,,巫女的爱情,在神社附近有神秘的声音叫住了你，一个自称神社巫女的姑娘想要寻求你的帮助,7,12003,鬼女的爱情,,36=0,0=0,36=0,0,2,,,,,10570=47,0=0,,,0,1,2,3,1,1,1,,,,,27|1011=1|47=156.01=23.85=204.6,,帮助巫女大人把许愿牌挂在樱花树上，让她与恋人相见吧,1|10570=47,Adventure_12001410_exec,挂上木牌后，巫女的恋人居然真的出现了，巫女要向你致谢,,,,,,,,,,2,5=0=3=10570=47=159=23.85=202.65=180|4=1=9=14|5=0=14=2=10570=10081,,,,1800010,樱花树下突然有人叫住了你，好像有什么事情需要帮忙,,12014,Adventure_12001410_accept,,0,,,,
12001420,12001410,,巫女的爱情,巫女在你的帮助之下见到了她的未婚夫，临行前还给了你请柬，去找村长问问吧，或许他知道些什么,7,12003,鬼女的爱情,,36=0,0=0,36=0,0,2,,,,,2553=47,2553=47,,,1,1,1,2,1,1,1,,,,,27|1012=1|47=166=16=103,,打开巫女大人给你的请柬看看有什么端倪,,,,,,,,,,,,,2,2=0=22=4059|2=0=14=1=0=10933|1=0=4=10570,,,,1800020,将请柬交给村长，邀请村长来参加巫女的婚礼,请柬上的日期居然是一百多年前的，问问村长这是怎么回事,12014,Adventure_12001420_accept,Adventure_12001420_finish,0,,,,
12001430,12001420,,巫女的爱情,你收到的请柬居然是一百年前的，而且村长告诉你，那个巫女大人早已去世。去找斐扬的年龄最大的老奶奶了解一下,7,12003,鬼女的爱情,,36=0,0=0,36=0,0,2,,,,,10571=47,0=0,,,1,1,2,2,1,1,1,,,,,25|100027=1|47=194.41=16.08=127.82,,听老奶奶讲巫女大人的故事,,,,,,,,,,,,,2,,,,,1800030,你遇到了早已过世的巫女？这怎么可能！去找斐扬最年长的老奶奶问问吧,,12014,Adventure_12001430_accept,,0,,,,
12001440,12001430,,巫女的爱情,巫女大人的故事着实可悲可叹，现在基本可以确定，你遇到的巫女似乎是幽灵，下一步怎么办呢？,7,12003,鬼女的爱情,,36=0,0=0,36=0,0,2,,,,,10571=47,0=0,,,1,1,2,2,1,1,1,,,,,3|200013=3|47=202.89=15.98=79.15,,前往竹林，收集一些制作灵符所需的韧竹条来,15|3060205=6|48=56.29=43.02=112.62,,制作灵符还需一些魔物灵气，据说消灭斐扬东南的大脚熊就能获得,,,,,,,,,,2,1=0=11=200013=3=47=203.66=15.98=79.13|4=1=12=200013=3|4=1=7=1176=10=48=60.61=43.20=114.80=5|2=0=8=1176=10,,,,1800040,向老奶奶问问巫女后来的事情,,12014,Adventure_12001440_accept,,0,,,,
12001450,12001440,,巫女的爱情,原来你之前遇到的巫女大人是地缚灵，根据斐扬的传统，遇见地缚灵的人，都要去遇见地缚灵的地方使用特殊符文，以保平安。按照老奶奶的指示去做吧~,7,12003,鬼女的爱情,,36=0,0=0,36=0,0,2,3060205=6,,,,10571=47,0=0,,,1,1,2,2,1,1,1,,,,,37|5=1,,等待老奶奶给你制作灵符,1|10571=47,Adventure_12001450_exec,老奶奶似乎还有事情要向你交代,27|1013=1|47=156.01=23.85=204.6,,前往神社，使用灵符，解除你与地缚灵的联系,,,,,,,2,4=1=14=2=10571=10152|2=0=3=10572=47=159=23.85=202.65=180|2=0=14=2=10572=10103,,,,1800050,制作符文所需的东西都已经搜集好了，交给老奶奶给你制作神秘符文,使用了灵符之后，巫女的地缚灵果然出现了，和她聊聊,12014,Adventure_12001450_accept,,0,,,,
12001460,12001450,,巫女的爱情,使用了老奶奶给你特殊符文，巫女大人的地缚灵真的出现了。 你来决定，要不要……把真相告诉她？,7,12003,鬼女的爱情,,36=0,0=0,36=0,0,2,,,,,10572=47,0=0,,,1,1,2,2,1,1,1,,,12001461|12001462,3,16|0=1,,思考一下要不要告诉鬼女真相,,,,,,,,,,,,,2,,,,,1800060,告诉巫女真相？还是依旧让她活在自己的梦里，做出决定吧,,12014,Adventure_12001460_accept,,0,,,,
12001461,,,告诉巫女事实,过去的就让它过去吧，巫女大人不能永远活在自己的梦里，告诉她事实真相，让她放下执念解脱吧,7,12003,鬼女的爱情,,36=0,0=0,36=0,0,2,,,,,10572=47,10571=47,,,1,1,1,2,1,1,1,,,,,7|2096=1||47=157.36=23.85=201.95,,得知真相后，巫女崩溃了，击败她化身的鬼女，让她解脱吧,,,,,,,,,,,,,2,1=0=1=2096|2=0=2=2096|2=0=4=10572,,,,1800070,告诉巫女她真相，让巫女大人放下执念解脱吧,终于让巫女大人的地缚灵解脱了，回去找老奶奶吧,12014,Adventure_12001461_accept,Adventure_12001461_finish,0,,,,
12001462,,,隐瞒巫女事实,真爱如此难得，而巫女大人她爱得这么辛苦，怎么能揭穿真相再次伤害她呢，顺着巫女大人的误会编制个善意的谎言，让巫女大人安心吧。,7,12003,鬼女的爱情,,36=0,0=0,36=0,0,2,,,,,10572=47,10571=47,,,1,1,1,2,1,1,1,,,,,37|2=1,,你不忍心告诉巫女大人真相，她信以为真,,,,,,,,,,,,,2,2=0=4=10572|2=0=9=100026,,,,1800080,隐瞒真相吧，巫女大人爱得这么辛苦，怎么能再次伤害她呢,回去找到老奶奶，告诉她你不忍心告诉巫女大人真相,12014,Adventure_12001462_accept,Adventure_12001462_finish,0,,,,
12001810,,,狸猫秘密计划,吉芬的金库丢失了一批红色魔法晶体，请你前去帮忙！,7,12005,狸猫帮,,41=0,0=0,41=0,0,2,,0,,,10150=16,10150=16,,,1,1,1,3,1,1,1,,,,,2|150067=1|16=67.61=17.01=71.36,,帮助累得气喘吁吁的法师抓住盗贼,3|200353=1|16=64.47=17.01=75.43,1,盗贼竟然是只狸猫，捡起它掉落的红色魔法晶体,,,,,,,,,,2,5=0=3=10150=16=109.25=17.01=46.01=233.00|3=0=4=10150|4=1=11=200353=1=16=64.47=17.01=75.43|2=0=12=200353=1|1=0=7=150067=1=16=67.61=17.01=71.36=1|4=1=8=150067=1|5=0=14=2=10150=10402|4=1=14=3=1023=10489|1=0=14=2=10150=11615|5=0=3=14678=16=97.10=17.01=42.90=214.00|1=0=4=14678,,,,1800090,你在吉芬撞见了一起失窃案,把从狸猫处追回的红色魔法晶体还给魔法师,12018,Adventure_12001810_accept,Adventure_12001810_finish,0,,,,
12001820,12001810,,狸猫秘密计划,确定了调查的方向，向狸猫帮进发！,7,12005,狸猫帮,,41=0,0=0,41=0,0,2,,0,,,1687=16,10151=12,,,1,1,1,2,1,1,1,,,,,5|0=1|12=60.13=2.23=73.98,,去吉芬西部寻找狸猫帮的踪迹,27|3005=1|12=49.44=5.30=66.26,,一位学者陷入了魔物的包围，用口哨转移魔物们的注意力,2|1023=5|12=49=5.30=66,,从魔物手中救出学者,,,,,,,2,1=0=3=10151=12=42.43=5.30=63.59=63.00|4=1=14=2=10151=10403|4=1=15=12001820|1=0=3=10160=12=43.47=5.35=65.44=197.53|1=0=3=10161=12=44.67=5.35=63.57=283.56|1=0=3=10162=12=43.12=5.35=61.61=9.21|4=2=4=10160|4=2=4=10161|4=2=4=10162|4=2=7=1023=8=12=48.27=5.35=65.17=6|4=3=8=1023=8|4=2=14=1=0=11616,,,,1800100,跟骑士团官员汇报你的发现,魔物学者对你的出手相救十分感激,12018,Adventure_12001820_accept,Adventure_12001820_finish,0,,,,
12001830,12001820,,狸猫秘密计划,这群狸猫聚集在这里是在搞什么鬼？这次来一定要调查清楚了。,7,12005,狸猫帮,,41=0,0=0,41=0,0,2,,0,,,10151=12,10152=12,,,1,1,1,2,1,1,1,,,,,5|0=1|12=52.36=2.48=100.16,,前往狸猫帮在北方的老巢,27|3060311=1|12=49.57=6.06=114.06,,变身成狸猫的样子,7|2019=1||12=48.88=5.35=112.84,,与狸猫对暗号（走到<color=$$Blue$$>观景台</color>找到狸猫王，注意观察狸猫们的动作，<color=$$Blue$$>用正确的顺序模仿一遍</color>，让他们信任你）,,,,,,,2,4=2=1=2019|2=0=2=2019|1=0=4=10151|4=2=10=905201|3=0=23=905201|4=3=3=10152=12=96.33=13.66=113.63=236.00|1=0=14=2=10151=11617|4=1=14=1=0=11618,,,,1800110,魔物学者惊讶于你为什么会来到这里,质问狸猫帮到底在密谋什么,12018,Adventure_12001830_accept,Adventure_12001830_finish,0,,,,
12001840,12001830,,狸猫秘密计划,看狸猫们窃窃私语，似乎隐藏着什么让他们兴奋的秘密,7,12005,狸猫帮,,41=0,0=0,41=0,0,2,,0,,,10152=12,10152=12,,,1,1,1,2,1,1,1,,,,,3|200354=1|12=91.39=13.37=116.87,,去望远镜里看看狸猫们聚在一起到底是为了什么秘密,,,,,,,,,,,,,2,1=0=11=200354=1=12=94.07=13.37=116.01|4=1=12=200354=1|4=1=9=17,,,,1800120,狸猫王准备给你分享它的秘密,这……狸猫王是不是在耍你？,12018,Adventure_12001840_accept,Adventure_12001840_finish,0,,,,
12001850,12001840,,狸猫秘密计划,那狸猫王觉得形势不太对，眼睛咕噜咕噜的转，似乎在打什么主意！,7,12005,狸猫帮,,41=0,0=0,41=0,0,2,,0,,,10152=12,1687=16,,,1,1,1,2,1,1,1,,,,,2|300003=1|12=95.52=13.66=113.56,,追上那只可恶的狸猫王，狠狠揍他一顿！,3|200355=1|12=82.92=13.12=117.81,,取回丢失的红色魔法晶体,,,,,,,,,,2,1=0=4=10152|1=0=7=300003=1=12=96.33=13.66=113.63=1|4=1=8=300003=1|4=1=11=200355=1=12=81.70=13.12=118.66|2=0=12=200355=1|1=0=14=1=0=10410|4=1=15=12001850|4=1=14=1=0=11619,,,,1800130,质问吉芬金库中丢失的红色魔法晶体去哪了！,丢失的矿石寻回，返回吉芬复命吧！,12018,Adventure_12001850_accept,Adventure_12001850_finish,0,,,,
12002410,,,卡尔西之殇,忠实骑士和拉比丝要结婚了？快去送上祝福！,7,12008,卡尔西,,46=0,0=0,46=0,0,2,,0,,,1283=7,10211=7,,,0,1,1,3,1,1,1,,,,,1|10210=7,Adventure_12002410_exec,忠实骑士和拉比丝要结婚了？快去恭喜他们！,,,,,,,,,,,,,2,1=0=3=10210=7=151.18=9.83=142.15=240|1=0=3=10211=7=140.22=10.00=53.76=180.00|1=0=3=10218=7=55.058=9.85=173.69=135| 5=0=27=97|1=0=22=6056|5=0=14=2=1283=11637,,,,1800140,你收到了来自忠实骑士的一封信件，他有什么事找你呢？,给卡尔西送去婚礼请柬,12024,Adventure_12002410_accept,Adventure_12002410_finish,0,,,,
12002420,12002410,,卡尔西之殇,帮忙的团团转的新郎忠实骑士给卡尔西送上邀请函吧,7,12008,卡尔西,,46=0,0=0,46=0,0,2,,0,,,10211=7,10211=7,,,1,1,2,2,1,1,1,,,12002430|12002440,3,16|0=1,,将婚礼请柬送到卡尔西手中,,,,,,,,,,,,,2,,,,,1800150,给卡尔西送去婚礼请柬,把卡尔西的请柬送过去吧,12024,Adventure_12002420_accept,Adventure_12002420_finish,0,,,,
12002430,,,卡尔西之殇|陪他喝酒,久别重逢，去陪卡尔西喝上一杯吧。,7,12008,卡尔西,,46=0,0=0,46=0,0,2,,0,,,10211=7,10211=7,,,1,1,2,2,1,1,1,,,,,21|110050=1|2006=141.35=10.00=52.19|7=141.35=10.00=52.19,,去跟卡尔西喝一杯吧（点击任务寻路到目的地，坐在椅子上喝一杯）,,,,,,,,,,,,,2,1=0=1=2006|2=0=2=2006|1=0=3=10239=2006=140.22=10.00=53.76=180.00|2=0=4=10239,,,,1800160,接受卡尔西的邀请,回复卡尔西,12024,Adventure_12002430_accept,Adventure_12002430_finish,0,,,,
12002440,,,卡尔西之殇|婉拒喝酒,还有任务在身，还是不要喝酒了吧。,7,12008,卡尔西,,46=0,0=0,46=0,0,2,,0,,,10211=7,10211=7,,,1,1,2,2,1,1,1,,,,,1|10211=7,Adventure_12002440_exec,告诉卡尔西你还有事要做,,,,,,,,,,,,,2,,,,,1800170,还是不去了，还有事要做,还是不去了，还有事要做,12024,Adventure_12002440_accept,Adventure_12002440_finish,0,,,,
12002450,,,卡尔西之殇,原来卡尔西酗酒是因为沉迷于梦中的世界，他请求你进入他的梦境帮他驱除噩梦中不好的东西,7,12008,卡尔西,,999=0,0=0,999=0,0,2,,0,,,10211=7,10211=7,,,1,1,1,2,1,1,1,,,,,27|3002=1|7=142.13=10.00=53.70,,进入卡尔西的梦境,5|0=1|2006=148.51=10.00=50.72|7=148.51=10.00=50.72,Adventure_12002450_exec_1,找到梦中的卡尔西,1|10229=2006||7=148.11=9.82=50.32,Adventure_12002450_exec_1,上前唤醒卡尔西,2|150073=5|2006=148.51=10.00=49.35|7=148.11=9.82=50.32,,赶走欺负克莱尔的魔物,1|10229=2006||7=148.11=9.82=50.32,Adventure_12002450_exec_2,卡尔西似乎对刚才的状况十分懊悔,2,1=0=4=10210|2=0=3=10213=7=138.41=10.22=179.12=274|2=0=3=10212=7=138.4=10.22=179.93=260|4=1=3=10229=2006=149.28=10.00=49.37=34.08|4=1=3=10230=2006=150.73=10.00=52.61=200.64|4=1=1=2006|2=0=2=2006|4=3=7=150073=5=2006=148.51=10.00=49.35=7|4=5=4=10229|4=4=4=10230|4=4=8=150073=5|4=2=15=12002450,,,,1800180,卡尔西似乎有事拜托你,卡尔西醒了吗？,12024,Adventure_12002450_accept,Adventure_12002450_finish,0,,1,,
12002460,12002440|12002430,,卡尔西之殇,婚礼就要开始了，快去观礼祝福新人吧！,7,12008,卡尔西,,46=0,0=0,46=0,0,2,,0,,,10211=7,10212=7,,,1,1,1,2,1,1,1,,,,,5|0=1|7=128.5=9.85=179.59,,婚礼快开始了，快去参加吧！,1|10212=7,Adventure_12002460_exec,婚礼真是太浪漫了，恭喜两个新人吧,9|0=1|7=136.41=10.40=179.08,"SelfPhoto|-60,-2.14",与这对新人合影留念,,,,,,,2,1=0=4=10210|5=0=3=10212=7=138.4=10.22=179.93=260|5=0=3=10213=7=138.41=10.22=179.12=274|1=0=4=10211|4=1=9=5,,,,1800190,卡尔西醒来了，问问他还好吗,婚礼真是太浪漫了，快去向新人表示祝福吧,12024,Adventure_12002460_accept,Adventure_12002460_finish,0,,,,
12002470,12002460,,卡尔西之殇,原来卡尔西的妻子已经……他现在就在墓地，去看看他吧,7,12008,卡尔西,,46=0,0=0,46=0,0,2,,0,,,10212=7,10214=7,3060063=1,3060063=1,1,1,1,2,1,1,1,,,,,1|10214=7,Adventure_12002470_exec,去墓地寻找卡尔西,27|3003=1|7=173.42=10.77=217.47,37.38,为克莱尔献上鲜花吧,,,,,,,,,,2,1=0=3=10214=7=172.66=10.7=219.3=107.5|4=1=4=10212|4=1=4=10213|3=0=14=2=10214=11630,,,,1800200,拉比丝指向的地方是……墓地？,卡尔西看起来极为悲伤,12024,Adventure_12002470_accept,Adventure_12002470_finish,0,,,,
12002480,12002470,,卡尔西之殇,名誉骑士有急事传唤你，似乎是因为之前的下水道事件查到了一些眉目,7,12008,卡尔西,,46=0,0=0,46=0,0,2,,0,,,10215=7,10215=7,,,0,3,1,2,1,1,1,,,,,1|10214=7,Adventure_12002480_01_exec,名誉骑士有急事传唤，跟卡尔西告别吧,1|10215=7,Adventure_12002480_02_exec,询问名誉骑士找到了什么线索,5|0=1|7=170.12=10.99=210.3,,卡尔西在进行秘密实验？找到他弄清楚这事,,,,,,,2,4=1=3=10215=7=130.5=9.8=189.17=280|4=2=4=10214|4=3=14=1=0=10490,,,,1800210,名誉骑士有急事传唤你前往,卡尔西不见了，快回去向名誉骑士禀报,12024,Adventure_12002480_accept,Adventure_12002480_finish,0,,,,
12002490,12002480,,卡尔西之殇,卡尔西怎么会和下水道事件扯在一起？这不可能，快去找他,7,12008,卡尔西,,46=0,0=0,46=0,0,2,,0,,,10215=7,10217=14,,,1,1,1,2,1,1,1,,,,,5|0=1|14=64.79=4.48=50.46,,找到魔物学者解答我们的疑问,,,,,,,,,,,,,2,2=0=3=10216=14=59.12=4.48=49.59=134.00|1=0=3=10217=14=60.69=5.38=39.40=44.00|1=0=4=10215|1=0=10=3520601|4=1=23=3520601,,,,1800220,卡尔西走之前有没有留下什么线索呢？再去检查一下,忠实骑士倒在了地上……这里究竟发生了什么？,12024,Adventure_12002490_accept,Adventure_12002490_finish,0,,,,
12002500,12002490,,卡尔西之殇,忠实骑士受伤了，拉比丝需要你的帮助,7,12008,卡尔西,,46=0,0=0,46=0,0,2,,0,,,10216=14,10218=7,,,1,1,1,2,1,1,1,,,,,1|10218=7,Adventure_12002500_exec,忠实骑士受伤了，快去找拉比丝,2|150070=4|7=55.68=9.80=171.95,,帮拉比丝赶走这些闻着味道寻来的魔物,,,,,,,,,,2,1=0=3=10225=7=54.39=9.85=172.835=135|2=0=3=10226=7=54.39=9.85=172.835=135|2=0=4=10225|4=1=7=150070=4=7=56.05=9.80=170.03=6|2=0=8=150070=4|1=0=4=10216|1=0=4=10217,,,,1800230,忠实骑士受伤了，先带他去治疗,忠实骑士的伤势已经稳定了,12024,Adventure_12002500_accept,Adventure_12002500_finish,0,,,,
12002510,12002500,,卡尔西之殇,卡尔西留下一封信？上面写着什么呢？,7,12008,卡尔西,,46=0,0=0,46=0,0,2,,0,,,10227=504,10218=7,,,0,3,1,2,1,1,1,,,,,1|10226=7,Adventure_12002510_exec,忠实骑士放心不下卡尔西,,,,,,,,,,,,,2,5=0=3=10227=504=99.27=14.99=115.53=121,,,,1800240,忠实骑士身上有一份卡尔西留下的信，打开读一读,忠实骑士十分担心卡尔西,12024,Adventure_12002510_accept,Adventure_12002510_finish,0,,,,
12002520,12002510,,卡尔西之殇,卡尔西的目的果然是要复活克莱尔，快去想办法阻止他！,7,12008,卡尔西,,46=0,0=0,46=0,0,2,,0,,,1634=16,10219=504,,,1,1,1,2,1,1,1,,,,,5|0=1|504=108.55=15.02=96.79,,原来卡尔西已经逃到了吉芬塔地下，快去找他！,1|10224=504,Adventure_12002520_exec,那个人是被卡尔西抓走的魔物学者！问问他发生了什么,5|0=1|504=103.22=14.97=115.25,,卡尔西就在那里！,,,,,,,2,1=0=3=10221=504=99.38=14.99=113.96=78|4=3=4=10224|4=1=3=10219=504=104.06=14.99=112.7=68|1=0=3=10224=504=114.57=15.20=110.09=210.01|2=0=16=6102|4=1=14=1=0=10491|1=0=24=2690502=504=99.38=14.99=113.96|4=3=4=10221|4=3=3=14675=504=99.38=14.99=113.96=78,,,,1800250,寻找忠实骑士的吉芬线人,卡尔西要复活克莱尔了！快阻止他！,12024,Adventure_12002520_accept,Adventure_12002520_finish,0,,,,
12002530,12002520,,卡尔西之殇,阻止卡尔西复活他的妻子！,7,12008,卡尔西,,46=0,0=0,46=0,0,2,,0,,,10219=504,10226=7,,,1,1,1,2,1,1,1,,,,,5|0=1|504=101.05=14.97=114.95,,快阻止卡尔西复活他的妻子！,1|10219=504,Adventure_12002530_02_exec,没想到竟然是这样的结局,,,,,,,,,,2,2=0=4=10219|3=0=4=10218|3=0=4=10226|4=1=4=14675|4=1=4=10227|4=1=16=6101|4=1=25=2690502,,,,1800260,复活的克莱尔已经魔化了，要尽快消灭她！,结束了……把卡尔西的遗言告诉忠实骑士吧,12024,Adventure_12002530_accept,Adventure_12002530_finish,0,,,,
19001998,,,萌物小分队,,7,19021,萌物小分队,,45=0,0=0,45=0,0,2,,,,,0=0,0=0,,,0,2,2,0,3,1,1,,,,,3|200608=1|16=123.65=17.03=143.70,,,,,,,,,,,,,,,2,1=0=11=200608=1=16=124.58=17.03=144.47|3=0=12=200608=1|1=0=24=2690965=16=124.58=17.43=144.47|3=0=25=2690965|4=1=22=4064,,,,1800270,,,19001,,,0,,,,
19001999,19001998,,萌物小分队,,7,19021,萌物小分队,,45=0,0=0,45=0,0,2,,,,,13426=16,0=0,,,0,1,2,2,1,1,1,,,,,7|2356=1||16=126.90=17.03=141.41,,脚力测试：跟住善司在规定时间内到达目标点<color=$$Blue$$>（可利用副本中的道具加速，任务失败后可重新接取）</color>,,,,,,,,,,,,,2,5=0=3=13426=16=127.31=17.03=143.1=248|1=0=1=2356|2=0=3=13425=16=108.28=17.03=42.21=190|2=0=4=13426,,,,1800280,旁边有个孩子跃跃欲试，好像有话要说,,19001,Explore_19001999_accept,,0,,,,
